{
  "paper_id": "min-p",
  "title": "Turning Up the Heat: Min-p Sampling for Creative and Coherent LLM Outputs",
  "venue": null,
  "code_url": null,
  "problem_definition": {
    "task": "Improve the quality-diversity trade-off in autoregressive text generation from large language models.",
    "input": "At each decoding step, the model's predicted probability distribution over the vocabulary for the next token, conditioned on the preceding context.",
    "output": "A sampled next token from a dynamically truncated subset of the vocabulary.",
    "evaluation_target": "min-p sampling should outperform existing sampling methods (top-p, top-k, temperature-only, η-sampling, ε-sampling, mirostat) at balancing coherence and diversity, especially at high temperatures, as measured by accuracy on reasoning benchmarks (GPQA, GSM8K), win rates on creative writing (AlpacaEval), and human preference scores."
  },
  "core_method": {
    "name": "min-p sampling",
    "one_line": "A dynamic truncation method that scales the minimum probability threshold by the probability of the most likely token, keeping only tokens whose probabilities are at least p_base × p_max, thereby adapting the sampling pool to the model's confidence at each step.",
    "atomic_steps": [
      {
        "id": "step-1",
        "description": "Retrieve the unnormalized logits vector for the next token from the language model.",
        "source_section": "sec-3",
        "depends_on_method": null
      },
      {
        "id": "step-2",
        "description": "Optionally divide logits by the temperature τ (if τ != 1.0) to control randomness.",
        "source_section": "sec-5.1",
        "depends_on_method": null
      },
      {
        "id": "step-3",
        "description": "Convert the (temperature-scaled) logits to probabilities using softmax.",
        "source_section": "sec-3",
        "depends_on_method": null
      },
      {
        "id": "step-4",
        "description": "Identify the maximum token probability p_max = max(probs).",
        "source_section": "sec-3",
        "depends_on_method": null
      },
      {
        "id": "step-5",
        "description": "Compute the dynamic truncation threshold scaled_min_p = p_base * p_max.",
        "source_section": "sec-3",
        "depends_on_method": null
      },
      {
        "id": "step-6",
        "description": "Create a boolean mask marking tokens whose probability is less than scaled_min_p as candidates for removal.",
        "source_section": "sec-3",
        "depends_on_method": null
      },
      {
        "id": "step-7",
        "description": "Sort token indices by original logit scores in descending order.",
        "source_section": "sec-3",
        "depends_on_method": null
      },
      {
        "id": "step-8",
        "description": "Modify the removal mask to keep at least min_tokens_to_keep tokens (default 1) by setting the top min_tokens_to_keep positions in the sorted order to not be removed.",
        "source_section": "sec-A.1",
        "depends_on_method": null
      },
      {
        "id": "step-9",
        "description": "Apply the final removal mask to the logits, setting the values of removed tokens to -inf (or a very low filter value).",
        "source_section": "sec-A.1",
        "depends_on_method": null
      },
      {
        "id": "step-10",
        "description": "Use the filtered logits for sampling (e.g., multinomial sampling) to select the next token.",
        "source_section": "sec-3",
        "depends_on_method": null
      }
    ],
    "settings": [
      {
        "id": "set-1",
        "name": "min-p (p_base=0.05)",
        "description": "Base threshold 0.05 – higher diversity setting, recommended range for creative tasks."
      },
      {
        "id": "set-2",
        "name": "min-p (p_base=0.1)",
        "description": "Base threshold 0.1 – balanced setting between coherence and diversity."
      },
      {
        "id": "set-3",
        "name": "min-p (p_base=0.2)",
        "description": "Base threshold 0.2 – lower diversity, used in human evaluation for conservative sampling."
      }
    ],
    "key_hyperparameters": [
      {
        "name": "p_base",
        "value": "0.05 or 0.1 (recommended); 0.2 used for low-diversity condition",
        "source_section": "sec-3.4"
      },
      {
        "name": "min_tokens_to_keep",
        "value": "1 (default)",
        "source_section": "sec-A.1"
      },
      {
        "name": "temperature (τ)",
        "value": "0.7 to 5.0 (main experiments use 0.7–4.0)",
        "source_section": "sec-5.1"
      }
    ]
  },
  "datasets": [
    {
      "name": "GPQA Main",
      "splits": [
        "test"
      ],
      "used_for": "graduate-level multiple-choice reasoning benchmark",
      "source_section": "sec-5.1"
    },
    {
      "name": "GSM8K",
      "splits": [
        "test"
      ],
      "used_for": "grade-school math word problems with chain-of-thought reasoning",
      "source_section": "sec-5.1"
    },
    {
      "name": "AlpacaEval Creative Writing",
      "splits": [
        "eval"
      ],
      "used_for": "automated evaluation of creative writing quality via LLM-as-judge",
      "source_section": "sec-5.1"
    }
  ],
  "models": [
    {
      "name": "Mistral 7B",
      "role": "language model (main evaluation)",
      "source_section": "sec-5.1"
    },
    {
      "name": "Mistral Large (123B)",
      "role": "language model (large-scale evaluation)",
      "source_section": "sec-5.2.1"
    },
    {
      "name": "Llama 3 (1B–70B)",
      "role": "language model (cross-model evaluation)",
      "source_section": "sec-5.2.1"
    },
    {
      "name": "Llama 3.2 70B",
      "role": "language model (additional benchmark)",
      "source_section": "sec-B.1"
    },
    {
      "name": "Llama 3 70B",
      "role": "language model (human evaluation)",
      "source_section": "sec-6"
    }
  ],
  "baselines": [
    {
      "name": "Temperature Only",
      "type": "temperature sampling (no truncation)",
      "reference": null,
      "source_section": "sec-5.1"
    },
    {
      "name": "Top-p",
      "type": "nucleus sampling (cumulative probability truncation)",
      "reference": "Holtzman et al., 2020",
      "source_section": "sec-5.1"
    },
    {
      "name": "Top-k",
      "type": "top-k truncation",
      "reference": "Fan et al., 2018",
      "source_section": "sec-5.1"
    },
    {
      "name": "η Sampling",
      "type": "entropy-based truncation",
      "reference": "Hewitt et al., 2022",
      "source_section": "sec-5.1"
    },
    {
      "name": "ε Sampling",
      "type": "entropy-based truncation",
      "reference": "Hewitt et al., 2022",
      "source_section": "sec-5.1"
    },
    {
      "name": "Mirostat",
      "type": "dynamic perplexity-controlled sampling",
      "reference": "Basu et al., 2021",
      "source_section": "sec-5.2.3"
    },
    {
      "name": "Standard Sampling (baseline for creative writing comparison)",
      "type": "fixed temperature-only sampling at τ=1.0",
      "reference": null,
      "source_section": "sec-5.2.3"
    }
  ],
  "metrics": [
    {
      "name": "Accuracy",
      "definition": "Percentage of correctly answered questions on GPQA Main and GSM8K CoT benchmarks.",
      "source_section": "sec-5.1"
    },
    {
      "name": "Win Rate",
      "definition": "Proportion of comparisons where the evaluated model's output is preferred over a baseline by the AlpacaEval LLM judge (GPT-4 Turbo).",
      "source_section": "sec-5.2.3"
    },
    {
      "name": "Length-Controlled Win Rate (LC-Win Rate)",
      "definition": "Win rate adjusted for output length bias to isolate quality from verbosity.",
      "source_section": "sec-5.2.3"
    },
    {
      "name": "Entropy of Correct Predictions",
      "definition": "Average continuous entropy of correct chain-of-thought answers, measured via language model embeddings and empirical covariance to quantify diversity.",
      "source_section": "sec-5.2.2"
    },
    {
      "name": "Human Quality Rating",
      "definition": "Mean subjective rating (1-10) of overall coherence, relevance and quality of generated stories by human evaluators.",
      "source_section": "sec-6"
    },
    {
      "name": "Human Diversity Rating",
      "definition": "Mean subjective rating (1-10) of how creative and distinct the three presented stories appeared to human evaluators.",
      "source_section": "sec-6"
    }
  ],
  "main_experiments": [
    {
      "id": "exp-table2",
      "evidence_in_paper": "table-2",
      "primary": true,
      "claim": "Min-p sampling outperforms top-p, top-k, temperature-only, and entropy-based methods on GPQA Main and GSM8K CoT benchmarks, particularly at higher temperatures (τ ≥ 1.5), maintaining accuracy while baselines degrade sharply.",
      "axes": {
        "rows": [
          "Temperature Only",
          "Top-k",
          "η Sampling",
          "ε Sampling",
          "Top-p",
          "min-p sampling"
        ],
        "cols": [
          "GPQA Main τ=0.7",
          "GPQA Main τ=1.0",
          "GPQA Main τ=1.5",
          "GPQA Main τ=2.0",
          "GPQA Main τ=3.0",
          "GSM8K CoT τ=0.7",
          "GSM8K CoT τ=1.0",
          "GSM8K CoT τ=1.5",
          "GSM8K CoT τ=2.0",
          "GSM8K CoT τ=3.0"
        ]
      },
      "settings_used": [
        "set-1",
        "set-2"
      ],
      "datasets_used": [
        "GPQA Main",
        "GSM8K"
      ],
      "models_used": [
        "Mistral 7B"
      ]
    },
    {
      "id": "exp-table3a",
      "evidence_in_paper": "table-3a",
      "primary": true,
      "claim": "Min-p's advantages persist with larger models; on Mistral Large (123B), min-p maintains high accuracy at temperatures up to τ=4.0 while top-p and temperature-only drop to near zero.",
      "axes": {
        "rows": [
          "Temperature Only",
          "Top-p (p=0.95)",
          "Top-p (p=0.90)",
          "min-p sampling"